"PathOrSystem","Decision","Reason","SaveRisk","FollowUp"
"Data/Scripts/Items","KeepInPlace","RunUO item framework and thousands of save surfaces should not be forced into Custom.","High","Classify system ownership and repair project truth before any local item extension move."
"Data/Scripts/Mobiles","KeepInPlace","Mobile framework includes PlayerMobile and save-heavy NPC content.","High","Do not move PlayerMobile; review individual custom extensions only."
"Data/Scripts/Magic","KeepInPlace","Established magic school and spell framework roots already carry namespace/build expectations.","High","Leave magic schools in place unless a later design isolates new custom-only extensions."
"Data/Scripts/System","KeepInPlace","Startup, command, packet, help, skill, and framework wiring belongs in System.","High","Audit active obsolete/system hooks before cleanup."
"Data/Scripts/Trades","KeepInPlace","Crafting, harvest, bulk orders, and gardening have conventional RunUO/Trades organization.","High","Repair moved gump includes before any Trades cleanup."
"Data/Scripts/Quests","KeepInPlace","Quest content is a stable non-Custom root with many gump and data assumptions.","Caution","Only move Confictura-native custom quest extensions after docs and build review."
"PlayerMobile Core","DoNotMove","Phase 6 marks PlayerMobile as a central save and policy hub.","DoNotMove","No move or namespace change without migration approval and save-load verification."
"Vendor Core","KeepInPlace","Vendor framework is economy infrastructure with many serialized mobiles.","High","Document economy dependencies; avoid folder churn."
"Obsolete Scripts","KeepInPlaceForNow","Legacy code can still register commands/hooks or preserve old saves.","High","Use Phase 13 backlog before disabling or moving."
